{
    "$schema": "http://json-schema.org/draft-07/schema#",
    "$id": "canon-file.json",
    "title": "CanonFile",
    "description": "A collection of canonical material tied to a particular time, place, or release",
    "properties": {
        "user": {
            "type": "string",
            "description": "The username that owns the document and may edit it."
        },
        "version": {
            "type": "integer",
            "description": "The iteration of the document. Every edit increases this by one."
        },
        "title": {
            "type": "string",
            "description": "The string to use when showing this item in menus and links."
        },
        "kind": {
            "type": "string",
            "enum": ["group", "song", "live", "album", "tour", "interview", "other", "symbol","theme"],
            "description": "The category that this item belongs to."
        },
        "metadata": {
            "$ref": "metadata.json"
        },
        "content": {
            "$ref": "content.json"
        },
        "annotations": {
            "$ref": "annotations.json"
        },
        "children": {
            "type": "array",
            "description": "A list of child document IDs. E.g. if this document is an album, the children are songs. The IDs here are relative - the path part is omitted.",
            "items": {
                "type": "string"
            },
            "minItems": 1
        }
    },
    "required": ["user", "version", "title", "kind", "annotations"],
    "additionalProperties": false
  }
  