{
  "user": "sudonhim",
  "version": 0,
  "title": "Miscellaneous",
  "kind": "group",
  "annotations": [],
  "children": [
    "other.1966_01_01_from_the_original_selected_poems_19561968",
    "other.1974_12_31_the_best_of_leonard_cohen_some_notes_on_the_songs",
    "other.1980_11_01_the_song_of_leonard_cohen",
    "other.1985_05_17_night_magic",
    "other.2001_02_27_the_song_of_leonard_cohen_portrait_of_a_poet_a_friendship_and_a_film"
  ]
}