{
  "title": "Buildings and Transport",
  "kind": "group",
  "user": "sudonhim",
  "version": 1,
  "annotations": [],
  "children": [
    "theme.bridge",
    "theme.house_bed_door_window_and_kitchen",
    "theme.road",
    "theme.ships_and_planes",
    "theme.temple",
    "theme.trains_and_stations"
  ]
}