{
  "title": "Did I Ever Love You",
  "content": {
    "content": {
      "text": [
        [
          "Did I ever love you",
          "Did I ever need you",
          "Did I ever fight you",
          "Did I ever want to"
        ],
        [
          "Did I ever leave you",
          "Was I ever able",
          "Or are we still leaning",
          "Across the old table"
        ],
        [
          "Was it ever settled",
          "Was it ever over",
          "And is it still raining",
          "Back in November"
        ],
        [
          "The lemon trees blossom",
          "The almond trees whither",
          "Was I ever someone",
          "Who could love you forever"
        ],
        [
          "Did I ever love you",
          "Does it really matter",
          "Did I ever fight you",
          "You donâ€™t need to answer"
        ],
        [
          "Did I ever leave you",
          "Was I ever able",
          "And are we still leaning",
          "Across the old table"
        ]
      ]
    }
  },
  "kind": "song",
  "annotations": [
    {
      "anchor": "p3.l3",
      "annotations": [
        {
          "user": "symbols bot",
          "content": [
            {
              "kind": "docref",
              "docRef": "symbol.rain"
            }
          ],
          "id": "1"
        }
      ],
      "newAnchor": "11"
    },
    {
      "anchor": "p4.l1",
      "annotations": [
        {
          "user": "symbols bot",
          "content": [
            {
              "kind": "docref",
              "docRef": "symbol.tree"
            }
          ],
          "id": "1"
        }
      ],
      "newAnchor": "13"
    }
  ],
  "user": "sudonhim",
  "version": 0
}