{
  "user": "sudonhim",
  "version": 0,
  "title": "Night Magic",
  "kind": "other",
  "annotations": [],
  "metadata": {
    "date": "1985-05-17"
  },
  "content": {
    "kind": "multipart",
    "content": [
      {
        "id": "variation_on_hunters_lullaby",
        "title": {
          "kind": "text",
          "tokens": [
            {
              "kind": "text",
              "text": "On "
            },
            {
              "kind": "reference",
              "reference": {
                "kind": "document",
                "documentId": "song.hunters_lullaby"
              }
            }
          ]
        },
        "fragments": [
          {
            "kind": "text",
            "id": "1",
            "tokens": [
              {
                "kind": "text",
                "text": "The song is sung by a female, and has a different ending:"
              }
            ]
          },
          {
            "kind": "lineBreak"
          },
          {
            "kind": "lineBreak"
          },
          {
            "kind": "text",
            "id": "2",
            "tokens": [
              {
                "kind": "text",
                "text": "And he's lost my lucky charm"
              }
            ]
          },
          {
            "kind": "lineBreak"
          },
          {
            "kind": "text",
            "id": "2",
            "tokens": [
              {
                "kind": "text",
                "text": "He's lost the guardian heart"
              }
            ]
          },
          {
            "kind": "lineBreak"
          },
          {
            "kind": "text",
            "id": "2",
            "tokens": [
              {
                "kind": "text",
                "text": "That keeps the hunter from the harm"
              }
            ]
          },
          {
            "kind": "lineBreak"
          },
          {
            "kind": "lineBreak"
          },
          {
            "kind": "text",
            "id": "2",
            "tokens": [
              {
                "kind": "text",
                "text": "There's a darkness in the thicket"
              }
            ]
          },
          {
            "kind": "lineBreak"
          },
          {
            "kind": "text",
            "id": "2",
            "tokens": [
              {
                "kind": "text",
                "text": "That was not there before"
              }
            ]
          },
          {
            "kind": "lineBreak"
          },
          {
            "kind": "text",
            "id": "2",
            "tokens": [
              {
                "kind": "text",
                "text": "And among the tangled undergrowth"
              }
            ]
          },
          {
            "kind": "lineBreak"
          },
          {
            "kind": "text",
            "id": "2",
            "tokens": [
              {
                "kind": "text",
                "text": "There is one tangle more"
              }
            ]
          },
          {
            "kind": "lineBreak"
          },
          {
            "kind": "text",
            "id": "2",
            "tokens": [
              {
                "kind": "text",
                "text": "Your father's gone a-hunting"
              }
            ]
          }
        ]
      }
    ]
  }
}