{
  "title": "People and Relationships",
  "kind": "group",
  "user": "sudonhim",
  "version": 1,
  "annotations": [],
  "children": [
    "theme.beggar",
    "theme.bride_and_bridegroom",
    "theme.doctor",
    "theme.god",
    "theme.gypsy",
    "theme.her_the_holy_spirit",
    "theme.hunter",
    "theme.jesus",
    "theme.killer",
    "theme.lovers_and_the_trinity",
    "theme.mothers_and_fathers",
    "theme.men_and_women",
    "theme.singer",
    "theme.soldier",
    "theme.stranger"
  ]
}